{
    "businessDay": "2024-07-11",
    "businessTimestamp": "2024-07-11T01:30:00Z",
    "crosaVersion": 1,
    "csProcessVersion": 2,
    "id": "c066ddf4dcd65cb3e8b66911",
    "selectedXnecResultId": "c21893330962af9db013e568",
    "timeHorizon": "dayAhead",
    "xnecList": [
        {
            "adjustedFmax": 84.33,
            "componentList": [
                {
                    "componentType": "allocatedFlow",
                    "value": -0.41,
                    "biddingZoneList": [
                        {
                            "biddingZoneCode": "10Y1001A1001A74G",
                            "value": -0.62
                        },
                        {
                            "biddingZoneCode": "10YFR-RTE------C",
                            "value": 0.21
                        }
                    ]
                },
                {
                    "componentType": "internalFlow",
                    "value": -0.45,
                    "biddingZoneList": [
                        {
                            "biddingZoneCode": "10Y1001A1001A74G",
                            "value": -0.62
                        },
                        {
                            "biddingZoneCode": "10YFR-RTE------C",
                            "value": 0.17
                        }
                    ]
                },
                {
                    "componentType": "loopFlow",
                    "value": -0.56,
                    "biddingZoneList": [
                        {
                            "biddingZoneCode": "10Y1001A1001A74G",
                            "value": -0.68
                        },
                        {
                            "biddingZoneCode": "10YFR-RTE------C",
                            "value": 0.12
                        }
                    ]
                },
                {
                    "componentType": "loopFlowOutsideCore",
                    "value": -0.13,
                    "biddingZoneList": [
                        {
                            "biddingZoneCode": "10Y1001A1001A74G",
                            "value": -0.62
                        },
                        {
                            "biddingZoneCode": "10YFR-RTE------C",
                            "value": 0.49
                        }
                    ]
                },
                {
                    "componentType": "pstFlow",
                    "value": -0.08,
                    "biddingZoneList": [
                        {
                            "biddingZoneCode": "10Y1001A1001A74G",
                            "value": -0.58
                        },
                        {
                            "biddingZoneCode": "10YFR-RTE------C",
                            "value": 0.5
                        }
                    ]
                }
            ],
            "convertedXnecId": "79c81adac4bc1c129855a0c2",
            "totalFlow": 86.93
        }
    ]
}