{
    "businessDay": "2024-04-12",
    "businessTimestamp": "2024-04-12T01:30:00Z",
    "crosaVersion": 1,
    "csProcessVersion": 5,
    "id": "12d4d7d5f7b113ca49c7a506",
    "selectedXnecResultId": "5611f6d8b74e7baa091b5a45",
    "timeHorizon": "dayAhead",
    "xnecList": [
        {
            "adjustedFmax": 70.98,
            "componentList": [
                {
                    "componentType": "allocatedFlow",
                    "value": 0.06,
                    "biddingZoneList": [
                        {
                            "biddingZoneCode": "10Y1001A1001A885",
                            "value": 0.3
                        },
                        {
                            "biddingZoneCode": "10Y1001A1001A885",
                            "value": 0.08
                        },
                        {
                            "biddingZoneCode": "10YRO-TEL------P",
                            "value": -0.32
                        }
                    ]
                },
                {
                    "componentType": "internalFlow",
                    "value": 0.04,
                    "biddingZoneList": [
                        {
                            "biddingZoneCode": "10Y1001A1001A885",
                            "value": 0.31
                        },
                        {
                            "biddingZoneCode": "10Y1001A1001A885",
                            "value": 0.05
                        },
                        {
                            "biddingZoneCode": "10YRO-TEL------P",
                            "value": -0.32
                        }
                    ]
                },
                {
                    "componentType": "loopFlow",
                    "value": -0.23,
                    "biddingZoneList": [
                        {
                            "biddingZoneCode": "10Y1001A1001A885",
                            "value": 0.24
                        },
                        {
                            "biddingZoneCode": "10Y1001A1001A885",
                            "value": 0.02
                        },
                        {
                            "biddingZoneCode": "10YRO-TEL------P",
                            "value": -0.49
                        }
                    ]
                },
                {
                    "componentType": "loopFlowOutsideCore",
                    "value": 0.11,
                    "biddingZoneList": [
                        {
                            "biddingZoneCode": "10Y1001A1001A885",
                            "value": 0.27
                        },
                        {
                            "biddingZoneCode": "10Y1001A1001A885",
                            "value": 0.04
                        },
                        {
                            "biddingZoneCode": "10YRO-TEL------P",
                            "value": -0.2
                        }
                    ]
                },
                {
                    "componentType": "pstFlow",
                    "value": -0.02,
                    "biddingZoneList": [
                        {
                            "biddingZoneCode": "10Y1001A1001A885",
                            "value": 0.26
                        },
                        {
                            "biddingZoneCode": "10Y1001A1001A885",
                            "value": 0.07
                        },
                        {
                            "biddingZoneCode": "10YRO-TEL------P",
                            "value": -0.35
                        }
                    ]
                }
            ],
            "convertedXnecId": "212b3eb7213d692472d0d23c",
            "totalFlow": 29.01
        }
    ]
}